{
  "$schema": "https://json-schema.org/draft/2020-12/schema",
  "$id": "https://app-structure.example/schema/app-structure-3.schema.json",
  "title": "App structure v3.1 (context-map.json)",
  "description": "One file per app project: the code tree (v2, unchanged), the product tree (3.1: feature tags, experience, core and variations), KPIs, lens plugins and per-feature lens values. Normative text: docs/standard/app-structure-v3.md. Unknown keys are allowed where readers ignore them (top level, features, facets, the v2 code tree and KPIs); the v3 grammar objects are closed.",
  "type": "object",
  "required": ["$schema", "version", "project"],
  "properties": {
    "$schema": { "const": "app-structure/3" },
    "version": { "const": 3 },
    "generator": { "type": "string" },
    "generated_at": { "$ref": "#/$defs/datetime" },
    "declared": { "type": "boolean" },
    "provenance": { "type": "object" },
    "project": {
      "type": "object",
      "required": ["slug", "name"],
      "properties": {
        "slug": { "$ref": "#/$defs/slug" },
        "name": { "type": "string", "minLength": 1 },
        "id": { "type": "string" },
        "description": { "type": "string" },
        "kind": { "type": "string" },
        "root": { "type": "string", "description": "Machine-specific; writers SHOULD omit it from git-tracked maps." }
      }
    },
    "taxonomy": {
      "type": "object",
      "additionalProperties": { "type": "array", "items": { "type": "string" } }
    },
    "stats": { "type": "object", "additionalProperties": { "type": "integer", "minimum": 0 } },

    "groups": { "type": "array", "items": { "$ref": "#/$defs/group" } },
    "contexts": { "type": "array", "items": { "$ref": "#/$defs/context" } },

    "domains": { "type": "array", "items": { "$ref": "#/$defs/domain" } },
    "capabilities": { "type": "array", "items": { "$ref": "#/$defs/capability" } },
    "features": { "type": "array", "items": { "$ref": "#/$defs/feature" } },
    "milestones": { "type": "array", "items": { "$ref": "#/$defs/milestone" } },
    "kpis": { "type": "array", "items": { "$ref": "#/$defs/kpi" } },
    "lenses": { "type": "array", "items": { "$ref": "#/$defs/lensEntry" } },
    "facets": {
      "description": "Lens values per feature: feature slug, then lens id.",
      "type": "object",
      "propertyNames": { "$ref": "#/$defs/slug" },
      "additionalProperties": {
        "type": "object",
        "propertyNames": { "$ref": "lens-manifest-1.schema.json#/$defs/lensId" },
        "additionalProperties": { "$ref": "#/$defs/facet" }
      }
    },
    "extensions": {
      "description": "Writer-specific data under reverse-DNS keys. Every writer keeps it.",
      "type": "object",
      "propertyNames": { "$ref": "lens-manifest-1.schema.json#/$defs/reverseDns" }
    }
  },
  "$defs": {
    "slug": { "type": "string", "pattern": "^[a-z0-9][a-z0-9.-]*$" },
    "date": { "type": "string", "pattern": "^\\d{4}-\\d{2}-\\d{2}$" },
    "datetime": { "type": "string", "pattern": "^\\d{4}-\\d{2}-\\d{2}T\\d{2}:\\d{2}(?::\\d{2}(?:\\.\\d+)?)?(?:Z|[+-]\\d{2}:\\d{2})$" },
    "stage": { "enum": ["idea", "specified", "in-dev", "in-review", "flagged", "live", "deprecated"] },
    "stringList": { "type": "array", "items": { "type": "string" } },
    "slugList": { "type": "array", "items": { "$ref": "#/$defs/slug" } },

    "group": {
      "description": "v2 context group, unchanged.",
      "type": "object",
      "required": ["name"],
      "properties": {
        "id": { "type": "string" },
        "name": { "type": "string", "minLength": 1 },
        "color": { "type": "string" },
        "domain": { "type": "string" },
        "context_count": { "type": "integer", "minimum": 0 }
      }
    },
    "context": {
      "description": "v2 context, unchanged. `name` is the stable key.",
      "type": "object",
      "required": ["name"],
      "properties": {
        "id": { "type": "string" },
        "name": { "type": "string", "minLength": 1 },
        "group": { "type": "string" },
        "group_id": { "type": "string" },
        "category": { "type": "string" },
        "business_feature": { "type": "string" },
        "description": { "type": "string" },
        "file_paths": { "$ref": "#/$defs/stringList" },
        "entry_points": { "$ref": "#/$defs/stringList" },
        "db_tables": { "$ref": "#/$defs/stringList" },
        "keywords": { "$ref": "#/$defs/stringList" },
        "api_surface": { "type": "string" },
        "cross_refs": { "type": "array" },
        "tech_stack": { "$ref": "#/$defs/stringList" },
        "pinned": { "type": "boolean" },
        "last_written_at": { "type": "string" }
      }
    },

    "domain": {
      "type": "object",
      "required": ["slug", "name"],
      "additionalProperties": false,
      "properties": {
        "slug": { "$ref": "#/$defs/slug" },
        "id": { "type": "string" },
        "name": { "type": "string", "minLength": 1 },
        "summary": { "type": "string" },
        "order": { "type": "number" },
        "source": { "enum": ["declared", "proposed"] }
      }
    },
    "capability": {
      "type": "object",
      "required": ["slug", "domain", "name"],
      "additionalProperties": false,
      "properties": {
        "slug": { "$ref": "#/$defs/slug" },
        "id": { "type": "string" },
        "domain": { "$ref": "#/$defs/slug" },
        "name": { "type": "string", "minLength": 1 },
        "summary": { "type": "string" },
        "order": { "type": "number" },
        "source": { "enum": ["declared", "proposed"] }
      }
    },

    "feature": {
      "type": "object",
      "required": ["slug", "name"],
      "properties": {
        "slug": { "$ref": "#/$defs/slug" },
        "id": { "type": "string" },
        "name": { "type": "string", "minLength": 1 },
        "summary": { "type": "string" },
        "kind": { "type": "string" },
        "tier": { "type": "string" },
        "status": { "enum": ["active", "archived"] },
        "capability": { "$ref": "#/$defs/slug" },
        "contexts": { "$ref": "#/$defs/stringList" },
        "primary_context": { "type": "string" },
        "stage": { "$ref": "#/$defs/stage" },
        "stage_since": { "$ref": "#/$defs/date" },
        "priority": { "enum": ["P0", "P1", "P2", "P3"] },
        "milestone": { "$ref": "#/$defs/slug" },
        "depends_on": { "$ref": "#/$defs/slugList" },
        "blocked_by": { "$ref": "#/$defs/slugList" },
        "owner": { "type": "string" },
        "built_by": { "$ref": "#/$defs/stringList" },
        "surfaces": { "$ref": "#/$defs/stringList" },
        "created": { "$ref": "#/$defs/date" },
        "parts": {
          "type": "array",
          "items": {
            "type": "object", "required": ["name", "done"], "additionalProperties": false,
            "properties": { "name": { "type": "string" }, "done": { "type": "boolean" } }
          }
        },
        "notes": {
          "type": "array",
          "items": {
            "type": "object", "required": ["by", "date", "text"], "additionalProperties": false,
            "properties": { "by": { "type": "string" }, "date": { "$ref": "#/$defs/date" }, "text": { "type": "string" } }
          }
        },
        "tags": { "description": "v3.1: free tags (Personas use cases, for example).", "$ref": "#/$defs/stringList" },
        "experience": { "description": "v3.1: the customer experience as it is today, one short paragraph.", "type": "string" },
        "core": {
          "description": "v3.1: what every variation shares: the shared technology and the core schema, as bullets.",
          "type": "object",
          "additionalProperties": false,
          "properties": { "tech": { "$ref": "#/$defs/stringList" }, "schema": { "$ref": "#/$defs/stringList" } }
        },
        "variations": {
          "description": "v3.1: per-customer or per-segment variations that extend the core. Lens values stay on the core feature.",
          "type": "array",
          "items": { "$ref": "#/$defs/variation" }
        }
      }
    },
    "variation": {
      "type": "object",
      "required": ["slug", "name", "audience", "extends", "params"],
      "additionalProperties": false,
      "properties": {
        "slug": { "$ref": "#/$defs/slug" },
        "name": { "type": "string", "minLength": 1 },
        "audience": { "type": "string", "minLength": 1 },
        "extends": { "$ref": "#/$defs/stringList" },
        "params": { "$ref": "#/$defs/stringList" },
        "stage": { "$ref": "#/$defs/stage" }
      }
    },

    "milestone": {
      "type": "object",
      "required": ["slug", "name", "status"],
      "additionalProperties": false,
      "properties": {
        "slug": { "$ref": "#/$defs/slug" },
        "id": { "type": "string" },
        "name": { "type": "string", "minLength": 1 },
        "status": { "enum": ["planned", "active", "shipped"] },
        "target_date": { "$ref": "#/$defs/date" },
        "goal": { "type": "string" }
      }
    },

    "kpiScope": {
      "description": "Exactly one of feature | context | group | project.",
      "type": "object",
      "minProperties": 1,
      "maxProperties": 1,
      "additionalProperties": false,
      "properties": {
        "feature": { "$ref": "#/$defs/slug" },
        "context": { "type": "string", "minLength": 1 },
        "group": { "type": "string", "minLength": 1 },
        "project": { "const": true }
      }
    },
    "kpi": {
      "description": "Carried over from Personas' dev_kpis; open, because Personas carries more columns than the standard names.",
      "type": "object",
      "required": ["slug", "name", "scope"],
      "properties": {
        "slug": { "$ref": "#/$defs/slug" },
        "id": { "type": "string" },
        "name": { "type": "string", "minLength": 1 },
        "scope": { "$ref": "#/$defs/kpiScope" },
        "category": { "enum": ["technical", "traffic", "value", "quality"] },
        "lens": { "$ref": "lens-manifest-1.schema.json#/$defs/lensId" },
        "unit": { "type": "string" },
        "direction": { "enum": ["up", "down"] },
        "baseline": { "type": "number" },
        "target": { "type": "number" },
        "target_date": { "$ref": "#/$defs/date" },
        "warn_at": { "type": "number" },
        "crit_at": { "type": "number" },
        "current": {
          "type": "object",
          "required": ["value"],
          "properties": {
            "value": { "type": "number" },
            "measured_at": { "$ref": "#/$defs/datetime" },
            "env": { "type": "string" }
          }
        },
        "status": { "type": "string" },
        "tier": { "type": "string" },
        "measure_kind": { "type": "string" }
      }
    },

    "lensEntry": {
      "type": "object",
      "required": ["id", "version", "source", "enabled", "manifest"],
      "additionalProperties": false,
      "properties": {
        "id": { "$ref": "lens-manifest-1.schema.json#/$defs/lensId" },
        "version": { "$ref": "lens-manifest-1.schema.json#/$defs/semver" },
        "source": { "enum": ["builtin", "project"] },
        "enabled": { "type": "boolean" },
        "manifest": { "$ref": "lens-manifest-1.schema.json" },
        "temporary": { "description": "A temporary lens (a refactor, a migration), made and retired from the blueprint. Absent = permanent.", "const": true },
        "created_at": { "$ref": "#/$defs/datetime" }
      },
      "allOf": [
        {
          "if": { "properties": { "source": { "const": "builtin" } } },
          "then": { "properties": { "id": { "$ref": "lens-manifest-1.schema.json#/$defs/builtinLensId" } } }
        },
        {
          "if": { "properties": { "source": { "const": "project" } }, "not": { "required": ["temporary"] } },
          "then": { "properties": { "id": { "$ref": "lens-manifest-1.schema.json#/$defs/reverseDns" } } }
        },
        {
          "if": { "required": ["temporary"] },
          "then": { "properties": { "source": { "const": "project" }, "id": { "$ref": "lens-manifest-1.schema.json#/$defs/tempLensId" } } }
        }
      ]
    },

    "facet": {
      "type": "object",
      "properties": {
        "values": {
          "description": "Field key to value. An unknown value is omitted, never null.",
          "type": "object",
          "propertyNames": { "$ref": "lens-manifest-1.schema.json#/$defs/fieldKey" },
          "additionalProperties": { "$ref": "lens-manifest-1.schema.json#/$defs/scalar" }
        },
        "applicable": { "type": "boolean" },
        "measured_at": { "$ref": "#/$defs/datetime" },
        "source": { "type": "string" },
        "override": {
          "type": "object",
          "required": ["health", "by", "why", "until"],
          "additionalProperties": false,
          "properties": {
            "health": { "$ref": "lens-manifest-1.schema.json#/$defs/computedHealth" },
            "by": { "type": "string", "minLength": 1 },
            "why": { "type": "string", "minLength": 1 },
            "until": { "$ref": "#/$defs/date" }
          }
        }
      }
    }
  }
}
